id,created_at,user_id,title,description,status,progress,project_id,domainId
10d4e6f8-6f5d-4b0d-9854-23de9f0abcde,2024-11-04 05:14:17.65623+00,f5cb0287-d141-4f8b-9632-98be8d7bcbe7,Fitness Tracker,Personalized fitness plans and progress tracking,active,0,,
31d35361-8792-4c79-895a-4c0dbe353415,2024-10-29 03:06:26.750089+00,f5cb0287-d141-4f8b-9632-98be8d7bcbe7,AI Productivity Suite,"Streamline all business operations using AI-driven tools, through forAnswer platform.",active,75,,103.01
8e2b1c4e-4d3b-4f8b-9632-98be8d7bcbe7,2024-11-04 05:14:17.65623+00,f5cb0287-d141-4f8b-9632-98be8d7bcbe7,Home Automation,Automate home tasks using AI agents,active,0,,
9f3c2d5f-5e4c-4a9c-8743-12cd8e9fcdef,2024-11-04 05:14:17.65623+00,f5cb0287-d141-4f8b-9632-98be8d7bcbe7,Personal Finance Management,AI-driven personal finance tracking and advice,active,35,,
b377c311-c44a-44d1-8533-bbdc29dfa9d8,2024-10-29 03:06:26.750089+00,f5cb0287-d141-4f8b-9632-98be8d7bcbe7,AI Healthcare Solutions,Revolutionizing healthcare with advanced AI models.,active,60,,100.01
c1c45943-f892-4352-a75d-77576bc2b354,2024-10-29 16:08:50.007437+00,f5cb0287-d141-4f8b-9632-98be8d7bcbe7,AI Financial Analytics,Revolutionize financial analysis with advanced AI models.,active,45,,105.01